{
  "schema_version": "avila.core/registry-snapshot/v0.2-draft",
  "semantic_profile": "avila.core/semantic/0.2-draft",
  "registry_id": "case-004.magnetic-compliance.registry",
  "revision": 1,
  "kinds": [
    {
      "kind_id": "core.ratio",
      "canonical_unit": "1",
      "unit_class": "core.ratio.units@1",
      "owner": "avila-labs.core",
      "units": [{ "symbol": "1", "factor": "1" }]
    }
  ],
  "purposes": [
    {
      "purpose": { "id": "avila-labs.magnetic-compliance.gate-0", "major": 1 },
      "owner": "avila-labs.magnetic-compliance",
      "description": "A research-only reduced-order gate deciding whether to test field-orthogonal support coupling on published stellarator geometry."
    }
  ],
  "roles": [
    {
      "role": { "id": "magnetic-compliance.checker-script", "major": 1 },
      "owner": "avila-labs.magnetic-compliance",
      "validator": "avila-labs.magnetic-compliance/reduced-feasibility@1",
      "accepted_media_types": ["text/x-python"],
      "permitted_claim_models": [{ "model": "unquantified" }]
    },
    {
      "role": { "id": "magnetic-compliance.feasibility-model", "major": 1 },
      "owner": "avila-labs.magnetic-compliance",
      "validator": "avila-labs.magnetic-compliance/reduced-feasibility@1",
      "accepted_media_types": ["application/vnd.avila.magnetic-compliance-model+json"],
      "permitted_claim_models": [{ "model": "unquantified" }]
    },
    {
      "role": { "id": "magnetic-compliance.exact-error-reduction", "major": 1 },
      "owner": "avila-labs.magnetic-compliance",
      "validator": "avila-labs.magnetic-compliance/reduced-feasibility@1",
      "quantity_kind": "core.ratio",
      "unit_class": "core.ratio.units@1",
      "accepted_media_types": ["application/vnd.avila.magnetic-compliance-result+json"],
      "permitted_claim_models": [{ "model": "exact" }]
    },
    {
      "role": { "id": "magnetic-compliance.nominal-load-error-ratio", "major": 1 },
      "owner": "avila-labs.magnetic-compliance",
      "validator": "avila-labs.magnetic-compliance/reduced-feasibility@1",
      "quantity_kind": "core.ratio",
      "unit_class": "core.ratio.units@1",
      "accepted_media_types": ["application/vnd.avila.magnetic-compliance-result+json"],
      "permitted_claim_models": [{ "model": "exact" }]
    },
    {
      "role": { "id": "magnetic-compliance.worst-compliance-ratio", "major": 1 },
      "owner": "avila-labs.magnetic-compliance",
      "validator": "avila-labs.magnetic-compliance/reduced-feasibility@1",
      "quantity_kind": "core.ratio",
      "unit_class": "core.ratio.units@1",
      "accepted_media_types": ["application/vnd.avila.magnetic-compliance-result+json"],
      "permitted_claim_models": [{ "model": "exact" }]
    },
    {
      "role": { "id": "magnetic-compliance.linearization-error", "major": 1 },
      "owner": "avila-labs.magnetic-compliance",
      "validator": "avila-labs.magnetic-compliance/reduced-feasibility@1",
      "quantity_kind": "core.ratio",
      "unit_class": "core.ratio.units@1",
      "accepted_media_types": ["application/vnd.avila.magnetic-compliance-result+json"],
      "permitted_claim_models": [{ "model": "exact" }]
    },
    {
      "role": { "id": "magnetic-compliance.resolution-difference", "major": 1 },
      "owner": "avila-labs.magnetic-compliance",
      "validator": "avila-labs.magnetic-compliance/reduced-feasibility@1",
      "quantity_kind": "core.ratio",
      "unit_class": "core.ratio.units@1",
      "accepted_media_types": ["application/vnd.avila.magnetic-compliance-result+json"],
      "permitted_claim_models": [{ "model": "exact" }]
    },
    {
      "role": { "id": "magnetic-compliance.derivative-difference", "major": 1 },
      "owner": "avila-labs.magnetic-compliance",
      "validator": "avila-labs.magnetic-compliance/reduced-feasibility@1",
      "quantity_kind": "core.ratio",
      "unit_class": "core.ratio.units@1",
      "accepted_media_types": ["application/vnd.avila.magnetic-compliance-result+json"],
      "permitted_claim_models": [{ "model": "exact" }]
    },
    {
      "role": { "id": "magnetic-compliance.coupling-share", "major": 1 },
      "owner": "avila-labs.magnetic-compliance",
      "validator": "avila-labs.magnetic-compliance/reduced-feasibility@1",
      "quantity_kind": "core.ratio",
      "unit_class": "core.ratio.units@1",
      "accepted_media_types": ["application/vnd.avila.magnetic-compliance-result+json"],
      "permitted_claim_models": [{ "model": "exact" }]
    },
    {
      "role": { "id": "magnetic-compliance.interpretation", "major": 1 },
      "owner": "avila-labs.magnetic-compliance",
      "validator": "avila-labs.magnetic-compliance/reduced-feasibility@1",
      "accepted_media_types": ["application/vnd.avila.magnetic-compliance-result+json"],
      "permitted_claim_models": [{ "model": "unquantified" }],
      "categorical_values": ["proceed", "stop"],
      "non_claims": [
        "The checker category mirrors its frozen arithmetic gate; Core's independently evaluated requirement verdicts remain authoritative for this case."
      ]
    }
  ],
  "capability_types": [
    {
      "capability_type": { "id": "magnetic-compliance.reduced-feasibility", "major": 1 },
      "owner": "avila-labs.magnetic-compliance",
      "reproducibility": { "determinism": "deterministic" },
      "inputs": [
        {
          "slot_id": "script",
          "role": { "id": "magnetic-compliance.checker-script", "major": 1 },
          "accepted_media_types": ["text/x-python"]
        },
        {
          "slot_id": "model",
          "role": { "id": "magnetic-compliance.feasibility-model", "major": 1 },
          "accepted_media_types": ["application/vnd.avila.magnetic-compliance-model+json"]
        }
      ],
      "outputs": [
        {
          "slot_id": "exact-error-reduction",
          "role": { "id": "magnetic-compliance.exact-error-reduction", "major": 1 },
          "media_type": "application/vnd.avila.magnetic-compliance-result+json",
          "permitted_claim_models": [{ "model": "exact" }]
        },
        {
          "slot_id": "nominal-load-error-ratio",
          "role": { "id": "magnetic-compliance.nominal-load-error-ratio", "major": 1 },
          "media_type": "application/vnd.avila.magnetic-compliance-result+json",
          "permitted_claim_models": [{ "model": "exact" }]
        },
        {
          "slot_id": "worst-compliance-ratio",
          "role": { "id": "magnetic-compliance.worst-compliance-ratio", "major": 1 },
          "media_type": "application/vnd.avila.magnetic-compliance-result+json",
          "permitted_claim_models": [{ "model": "exact" }]
        },
        {
          "slot_id": "linearization-error",
          "role": { "id": "magnetic-compliance.linearization-error", "major": 1 },
          "media_type": "application/vnd.avila.magnetic-compliance-result+json",
          "permitted_claim_models": [{ "model": "exact" }]
        },
        {
          "slot_id": "resolution-difference",
          "role": { "id": "magnetic-compliance.resolution-difference", "major": 1 },
          "media_type": "application/vnd.avila.magnetic-compliance-result+json",
          "permitted_claim_models": [{ "model": "exact" }]
        },
        {
          "slot_id": "derivative-difference",
          "role": { "id": "magnetic-compliance.derivative-difference", "major": 1 },
          "media_type": "application/vnd.avila.magnetic-compliance-result+json",
          "permitted_claim_models": [{ "model": "exact" }]
        },
        {
          "slot_id": "coupling-share",
          "role": { "id": "magnetic-compliance.coupling-share", "major": 1 },
          "media_type": "application/vnd.avila.magnetic-compliance-result+json",
          "permitted_claim_models": [{ "model": "exact" }]
        },
        {
          "slot_id": "interpretation",
          "role": { "id": "magnetic-compliance.interpretation", "major": 1 },
          "media_type": "application/vnd.avila.magnetic-compliance-result+json",
          "permitted_claim_models": [{ "model": "unquantified" }]
        }
      ],
      "non_claims": [
        "This capability does not establish a practical support, structural safety, manufacturability, lower mass or cost, confinement performance, novelty, or patentability."
      ]
    }
  ]
}
